id	title	content	questionType	difficulty	subject	board	grade	topicTags	marks	timeLimit	isPublished	createdAt	updatedAt	analytics
a2816a8e-a36e-4969-8d05-4eb288fbf8b8	Conservation of Momentum in a Two-Body Collision	Two ice skaters, Skater A with a mass of 50 kg and Skater B with a mass of 70 kg, are initially at rest on a frictionless ice rink. They push off against each other, and Skater A moves backward with a velocity of 2 m/s. What is the velocity of Skater B after they push off?	mcq	medium	physics	general	Class 11	{Conservation of Momentum}	1	2	true	2025-07-14T02:23:04.249Z	2025-07-14T02:23:04.249Z	{}
2660844e-880f-492b-9a93-deeb872fab0e	Understanding Dimensional Consistency in Physical Equations	A scientist proposes a new equation to describe a physical phenomenon: \( E = k \cdot x^a \cdot v^b \), where \( E \) is energy measured in joules (J), \( x \) is distance in meters (m), \( v \) is velocity in meters per second (m/s), and \( k \) is a dimensionless constant. What are the correct values of \( a \) and \( b \) to ensure the dimensional consistency of the equation?	mcq	medium	physics	general	Class 11	{Units and Measurements}	1	2	true	2025-07-14T02:23:04.249Z	2025-07-14T02:23:04.249Z	{}
f57a5d1a-c674-4214-8edb-2596bcfc41ef	Understanding Scalars and Vectors	A student is analyzing the motion of a car moving along a straight path. At a given instant, the car has a velocity of 20 m/s in the eastward direction and is subject to a deceleration of 2 m/s² in the same direction. Which of the following statements best describes the quantities involved in this scenario?	mcq	medium	physics	general	Class 11	{Scalars and Vectors}	1	2	true	2025-07-14T02:23:04.249Z	2025-07-14T02:23:04.249Z	{}
85bb3711-b327-442c-979a-63e5e8dd38ea	Analyzing Motion with Constant Acceleration	A car accelerates uniformly from rest along a straight road. After traveling a distance of 200 meters, its speed is 20 m/s. What is the car's acceleration?	mcq	medium	physics	general	Class 11	{Motion in a Straight Line}	1	2	true	2025-07-14T02:23:04.249Z	2025-07-14T02:23:04.249Z	{}
d9dede6a-fa01-4291-8aaa-8f22c715deab	Projectile Motion: Maximum Height Calculation	A projectile is launched from the ground with an initial velocity of 20 m/s at an angle of 30 degrees above the horizontal. Assuming air resistance is negligible, what is the maximum height reached by the projectile?	mcq	medium	physics	general	Class 11	{Motion in a Plane}	1	2	true	2025-07-14T02:23:04.249Z	2025-07-14T02:23:04.249Z	{}
593b5224-04f8-475b-9837-405e9a5bd371	Projectile Motion: Maximum Height and Range	A projectile is launched from the ground with an initial speed of 40 m/s at an angle θ with respect to the horizontal. The projectile reaches its maximum height when it is 30 m above the launch point. Assume air resistance is negligible and take g = 9.8 m/s². What is the horizontal distance covered by the projectile when it returns to the ground?	mcq	medium	physics	general	Class 11	{Projectile Motion}	1	2	true	2025-07-14T02:23:04.249Z	2025-07-14T02:23:04.249Z	{}
f24dd8cd-6d6a-46d7-932f-b8ba05d7619b	Understanding Relative Velocity in River Crossing	A swimmer is attempting to cross a river that flows eastward with a velocity of 3 m/s relative to the shore. The swimmer can swim with a velocity of 5 m/s relative to the water. If the swimmer wants to reach the point directly opposite on the other bank, at what angle to the north should the swimmer aim upstream?	mcq	medium	physics	general	Class 11	{Relative Velocity}	1	2	true	2025-07-14T02:23:04.249Z	2025-07-14T02:23:04.249Z	{}
154e3eca-f55a-457b-a32a-48e90981f146	Understanding Forces in Equilibrium	A block of mass 5 kg is placed on a smooth, frictionless horizontal surface. It is connected to a wall by a horizontal spring with a spring constant of 200 N/m. Initially, the spring is at its natural length. A horizontal force is applied to the block, causing the spring to stretch by 0.1 m. What is the magnitude of the force applied to the block?	mcq	medium	physics	general	Class 11	{Laws of Motion}	1	2	true	2025-07-14T02:23:04.249Z	2025-07-14T02:23:04.249Z	{}
19689099-5aff-4591-9481-05f5c96895c4	Friction and Inclined Plane	A block of mass 5 kg is placed on a rough inclined plane that makes an angle of 30° with the horizontal. The coefficient of static friction between the block and the plane is 0.4. What is the maximum force parallel to the plane that can be applied upwards on the block without causing it to move?	mcq	medium	physics	general	Class 11	{Friction}	1	2	true	2025-07-14T02:23:04.249Z	2025-07-14T02:23:04.249Z	{}
e594b82c-344c-491f-94d4-c3f8553bc008	Centripetal Force on a Rotating Disk	A small object of mass m is placed on a horizontal, frictionless disk that rotates with a constant angular velocity ω about a vertical axis through its center. The object is located at a distance r from the center of the disk. Which of the following expressions correctly represents the magnitude of the centripetal force acting on the object?	mcq	medium	physics	general	Class 11	{Circular Motion}	1	2	true	2025-07-14T02:23:04.249Z	2025-07-14T02:23:04.249Z	{}
9f140ded-4551-4999-955f-b0d186df3e86	Work and Energy in a Variable Force Field	A 2 kg object moves along the x-axis under the influence of a variable force given by F(x) = 3x^2 + 4x - 5 (in Newtons), where x is in meters. If the object moves from x = 1 m to x = 3 m, what is the work done on the object by the force?	mcq	medium	physics	general	Class 11	{Work, Energy and Power}	1	2	true	2025-07-14T02:23:04.249Z	2025-07-14T02:23:04.249Z	{}
7b064e44-b9e9-4ea5-954c-339f79a90b22	Conservation of Energy in a Spring-Mass System	A block of mass 2 kg is attached to a horizontal spring with a spring constant of 200 N/m. The spring is initially compressed by 0.1 m and then released from rest on a frictionless surface. What is the speed of the block when it passes through the equilibrium position of the spring?	mcq	medium	physics	general	Class 11	{Conservation of Energy}	1	2	true	2025-07-14T02:23:04.249Z	2025-07-14T02:23:04.249Z	{}
975cce43-8931-40c1-80ec-8d02673c2cb3	Conservation of Momentum in a Two-Body Collision	Two ice skaters, Skater A with a mass of 50 kg and Skater B with a mass of 70 kg, are initially at rest on a frictionless ice surface. They push off against each other and move in opposite directions. If Skater A moves with a velocity of 3 m/s, what is the velocity of Skater B?	mcq	medium	physics	general	Class 11	{Conservation of Momentum}	1	2	true	2025-07-14T02:23:04.249Z	2025-07-14T02:23:04.249Z	{}
2681fbc9-76dc-44da-a151-704429531f9c	Understanding Dimensional Consistency	A scientist is testing a new formula to calculate the force exerted by a mysterious particle. The proposed formula is F = k * (m^2 * v) / (d * t), where F is the force, m is the mass, v is the velocity, d is the distance, t is the time, and k is a dimensionless constant. Which of the following options correctly represents the dimensions of the force F?	mcq	medium	physics	general	Class 11	{Units and Measurements}	1	2	true	2025-07-14T02:23:04.249Z	2025-07-14T02:23:04.249Z	{}
dc13eeca-ad35-4e3d-812d-90c6ff6b4979	Vector Addition in Two Dimensions	Consider two vectors \( \mathbf{A} \) and \( \mathbf{B} \) in a plane. Vector \( \mathbf{A} \) has a magnitude of 5 units and points east, while vector \( \mathbf{B} \) has a magnitude of 5 units and points north. What is the magnitude of the resultant vector \( \mathbf{R} = \mathbf{A} + \mathbf{B} \)?	mcq	medium	physics	general	Class 11	{Scalars and Vectors}	1	2	true	2025-07-14T02:23:04.249Z	2025-07-14T02:23:04.249Z	{}
82127fd1-9cb3-418e-8cac-072ac53a1df8	Kinematic Analysis of Uniform Acceleration	A car starts from rest and accelerates uniformly over a straight road. After 5 seconds, it reaches a velocity of 20 m/s. What is the total distance covered by the car during this time?	mcq	medium	physics	general	Class 11	{Motion in a Straight Line}	1	2	true	2025-07-14T02:23:04.249Z	2025-07-14T02:23:04.249Z	{}
0ae4f7e9-26d7-47d3-8fef-717bc0c78009	Projectile Motion Analysis	A projectile is launched with an initial speed of 20 m/s at an angle of 30 degrees above the horizontal. Ignoring air resistance, what is the maximum height reached by the projectile?	mcq	medium	physics	general	Class 11	{Motion in a Plane}	1	2	true	2025-07-14T02:23:04.249Z	2025-07-14T02:23:04.249Z	{}
f648a701-7a70-4a7a-959a-17b7a485ed77	Projectile Motion: Maximum Height	A projectile is launched from the ground with an initial speed of 20 m/s at an angle of 30 degrees above the horizontal. Assuming no air resistance, what is the maximum height reached by the projectile?	mcq	medium	physics	general	Class 11	{Projectile Motion}	1	2	true	2025-07-14T02:23:04.249Z	2025-07-14T02:23:04.249Z	{}
08066f6a-f6e4-4de8-884e-77ff0f6f08be	Relative Velocity: River Crossing Problem	A swimmer wants to cross a river flowing eastward with a speed of 3 m/s. The swimmer can swim with a speed of 4 m/s relative to the water. In which direction should the swimmer head to cross the river in the shortest time possible, and what will be the resultant speed of the swimmer relative to the ground?	mcq	medium	physics	general	Class 11	{Relative Velocity}	1	2	true	2025-07-14T02:23:04.249Z	2025-07-14T02:23:04.249Z	{}
0b31f677-a35b-47cf-821a-d589065502ec	Friction and Motion on an Inclined Plane	A block of mass m is placed on a frictionless inclined plane making an angle θ with the horizontal. A horizontal force F is applied to the block, pushing it up the incline with constant velocity. Which of the following expressions correctly represents the magnitude of force F needed to achieve this motion?	mcq	medium	physics	general	Class 11	{Laws of Motion}	1	2	true	2025-07-14T02:23:04.249Z	2025-07-14T02:23:04.249Z	{}
1beecede-1e44-4211-bfa3-e0ce5e49761c	Understanding the Influence of Friction on Motion	A block of mass 5 kg is placed on a rough horizontal surface with a coefficient of static friction μs = 0.6 and a coefficient of kinetic friction μk = 0.4. A horizontal force is gradually applied to the block. What is the minimum horizontal force required to start moving the block?	mcq	medium	physics	general	Class 11	{Friction}	1	2	true	2025-07-14T02:23:04.249Z	2025-07-14T02:23:04.249Z	{}
13457605-8bbd-4171-9318-7347ef347b59	Understanding Angular Velocity in Circular Motion	A particle is moving in a circular path of radius 0.5 meters with a constant speed. If the particle completes one full revolution in 4 seconds, what is its angular velocity?	mcq	medium	physics	general	Class 11	{Circular Motion}	1	2	true	2025-07-14T02:23:04.249Z	2025-07-14T02:23:04.249Z	{}
cdaf2db3-f1e5-495a-aa26-3288ed2bf72a	Work Done on an Inclined Plane	A block of mass 5 kg is pushed up a frictionless inclined plane of angle 30° to the horizontal. The block is moved a distance of 10 meters along the incline. What is the work done by the applied force if the block moves at a constant speed?	mcq	medium	physics	general	Class 11	{Work, Energy and Power}	1	2	true	2025-07-14T02:23:04.249Z	2025-07-14T02:23:04.249Z	{}
9a717039-8c28-4818-a90b-009fd0cf05f1	Conservation of Energy in a Pendulum System	A simple pendulum of length L and mass m is released from rest at an angle θ₀ with the vertical. Assume no air resistance or friction. At the lowest point of its swing, what is the speed v of the pendulum bob?	mcq	medium	physics	general	Class 11	{Conservation of Energy}	1	2	true	2025-07-14T02:23:04.249Z	2025-07-14T02:23:04.249Z	{}
0473e0d9-b887-4d95-b6cd-2b9198beb901	Conservation of Momentum in an Explosive Scenario	A stationary bomb with a mass of 10 kg explodes into three fragments. Two of the fragments, each with a mass of 3 kg, move in perpendicular directions with velocities of 4 m/s and 3 m/s, respectively. Determine the velocity of the third fragment immediately after the explosion.	mcq	medium	physics	general	Class 11	{Conservation of Momentum}	1	2	true	2025-07-14T02:23:04.249Z	2025-07-14T02:23:04.249Z	{}
08beedfd-68ad-438d-b130-d60187b62872	Understanding Dimensional Analysis	A new physical quantity X is defined in terms of the physical quantities A, B, and C as follows: X = A^2 * √(B/C). The dimensions of A are [M^1 L^0 T^0], B are [M^0 L^1 T^-2], and C are [M^0 L^1 T^0]. What are the dimensions of the new quantity X?	mcq	medium	physics	general	Class 11	{Units and Measurements}	1	2	true	2025-07-14T02:23:04.249Z	2025-07-14T02:23:04.249Z	{}
917640e5-c8d5-456e-b6fd-dc639883b5f6	Understanding Scalars and Vectors	A student is analyzing different physical quantities to categorize them as either scalars or vectors. Which of the following quantities is correctly identified as a vector?	mcq	medium	physics	general	Class 11	{Scalars and Vectors}	1	2	true	2025-07-14T02:23:04.249Z	2025-07-14T02:23:04.249Z	{}
e824ec99-7f4d-43c8-8858-5f5f9a9bb56a	Understanding Constant Acceleration	A car starts from rest and accelerates uniformly along a straight road. After traveling a distance of 100 meters, the car reaches a speed of 20 m/s. What is the car's acceleration?	mcq	medium	physics	general	Class 11	{Motion in a Straight Line}	1	2	true	2025-07-14T02:23:04.249Z	2025-07-14T02:23:04.249Z	{}
69bd9a44-61d1-4eb1-96b8-ed7af0bd4613	Motion in a Plane: Projectile Motion Analysis	A projectile is launched from the top of a 50-meter high cliff with an initial velocity of 20 m/s at an angle of 30 degrees above the horizontal. Assuming no air resistance, what is the horizontal distance traveled by the projectile before it hits the ground?	mcq	medium	physics	general	Class 11	{Motion in a Plane}	1	2	true	2025-07-14T02:23:04.249Z	2025-07-14T02:23:04.249Z	{}
b28ef9f4-6c3b-47b5-88c6-753f64a2ea82	Projectile Motion: Maximum Height and Range Relationship	A projectile is launched from the ground with an initial velocity of 40 m/s at an angle θ above the horizontal. If the maximum height reached by the projectile is 40 meters, what is the range of the projectile? Assume that air resistance is negligible and g = 9.8 m/s².	mcq	medium	physics	general	Class 11	{Projectile Motion}	1	2	true	2025-07-14T02:23:04.249Z	2025-07-14T02:23:04.249Z	{}
649159b3-588a-4538-bd9c-cd3a419a0e8b	Relative Velocity in a Moving Medium	A boat is attempting to cross a river that is 200 meters wide. The water in the river flows eastward at 3 m/s. The boat itself can move at a speed of 5 m/s relative to the water. If the boat sets off from the southern bank heading directly north, what will be the resultant velocity of the boat relative to an observer standing on the riverbank?	mcq	medium	physics	general	Class 11	{Relative Velocity}	1	2	true	2025-07-14T02:23:04.249Z	2025-07-14T02:23:04.249Z	{}
a225f5f4-7f34-49fe-be29-7de57f0040b7	Friction on an Inclined Plane	A block of mass m is placed on a rough inclined plane with an angle of inclination θ with the horizontal. The coefficient of static friction between the block and the plane is μs. What is the maximum angle θ_max at which the block will remain at rest on the plane?	mcq	medium	physics	general	Class 11	{Laws of Motion}	1	2	true	2025-07-14T02:23:04.249Z	2025-07-14T02:23:04.249Z	{}
501ff3e7-b0c1-48a7-904b-8ae92b3fa2e1	Understanding Friction on an Inclined Plane	A block of mass 5 kg is placed on a rough inclined plane making an angle of 30° with the horizontal. The coefficient of static friction between the block and the plane is 0.4. What is the maximum force parallel to the plane that can be applied upward on the block without causing it to move?	mcq	medium	physics	general	Class 11	{Friction}	1	2	true	2025-07-14T02:23:04.249Z	2025-07-14T02:23:04.249Z	{}
eb79da33-5cc9-42e0-8ce4-4b52cf3af8e2	Understanding Centripetal Force in Uniform Circular Motion	A car of mass 1500 kg is moving with a constant speed of 20 m/s around a circular track of radius 100 meters. What is the magnitude of the centripetal force acting on the car?	mcq	medium	physics	general	Class 11	{Circular Motion}	1	2	true	2025-07-14T02:23:04.249Z	2025-07-14T02:23:04.249Z	{}
bb6dae8f-0da9-4ff5-8772-f2e092e685b1	Work Done on an Inclined Plane	A block of mass 10 kg is pushed up a frictionless inclined plane that makes an angle of 30 degrees with the horizontal. If a constant force of 100 N is applied parallel to the incline, moving the block 5 meters up the incline, what is the work done by the applied force?	mcq	medium	physics	general	Class 11	{Work, Energy and Power}	1	2	true	2025-07-14T02:23:04.249Z	2025-07-14T02:23:04.249Z	{}
dd7d0f8a-dbf1-44ea-be4f-b66ad32fb440	Conservation of Energy in a Pendulum System	A simple pendulum of length L and mass m is released from a height h above its lowest point. Assuming no air resistance and that the pendulum behaves as a simple harmonic oscillator, at what height above the lowest point will the pendulum have half of its maximum speed?	mcq	medium	physics	general	Class 11	{Conservation of Energy}	1	2	true	2025-07-14T02:23:04.249Z	2025-07-14T02:23:04.249Z	{}
32707f7a-3156-4f10-8b99-2b09c9066ac9	Conservation of Momentum in a Two-Body Collision	Two ice skaters, skater A and skater B, initially at rest on a frictionless ice surface, push off against each other. Skater A has a mass of 50 kg and skater B has a mass of 75 kg. After the push, skater A moves with a velocity of 3 m/s to the east. What is the velocity of skater B?	mcq	medium	physics	general	Class 11	{Conservation of Momentum}	1	2	true	2025-07-14T02:23:04.249Z	2025-07-14T02:23:04.249Z	{}
14ba139f-8760-44c6-bf5e-52da5d7da52e	Understanding Dimensional Analysis in Physics	Which of the following equations is dimensionally consistent?	mcq	medium	physics	general	Class 11	{Units and Measurements}	1	2	true	2025-07-14T02:23:04.249Z	2025-07-14T02:23:04.249Z	{}
7aa2cbc0-7b0a-4c22-a29f-c3f2f94a75aa	Scalars and Vectors: Understanding Their Differences	Consider two physical quantities: A represents the speed of a car traveling along a straight road, while B represents the displacement of the car from its starting point. Which of the following statements is correct regarding these two quantities?	mcq	medium	physics	general	Class 11	{Scalars and Vectors}	1	2	true	2025-07-14T02:23:04.249Z	2025-07-14T02:23:04.249Z	{}
4200a494-d4fa-44e3-9d6e-df96b2b79de3	Understanding Uniformly Accelerated Motion	A car moving in a straight line accelerates uniformly from an initial velocity of 5 m/s to a final velocity of 25 m/s over a period of 10 seconds. What is the total distance covered by the car during this time?	mcq	medium	physics	general	Class 11	{Motion in a Straight Line}	1	2	true	2025-07-14T02:23:04.249Z	2025-07-14T02:23:04.249Z	{}
9a4973b4-ceed-4c1b-85ae-684aa729fe4d	Projectile Motion and Maximum Range	A projectile is launched from the ground with an initial speed of \( v_0 \) at an angle \( \theta \) above the horizontal. Assuming there is no air resistance, at what angle \( \theta \) should the projectile be launched to achieve the maximum horizontal range?	mcq	medium	physics	general	Class 11	{Motion in a Plane}	1	2	true	2025-07-14T02:23:04.249Z	2025-07-14T02:23:04.249Z	{}
02970d9c-1812-4e73-a105-e91cb1129981	Projectile Motion: Maximum Height	A ball is launched from ground level with an initial velocity of 20 m/s at an angle of 30 degrees above the horizontal. Assuming no air resistance, what is the maximum height reached by the ball?	mcq	medium	physics	general	Class 11	{Projectile Motion}	1	2	true	2025-07-14T02:23:04.249Z	2025-07-14T02:23:04.249Z	{}
58da300c-d706-4506-8e2b-3dc3523ba1bd	Relative Velocity of Two Boats on a River	Two boats, A and B, are on a river that flows eastward with a velocity of 3 m/s relative to the ground. Boat A travels with a velocity of 7 m/s relative to the river in a direction perpendicular to the river flow (north), while Boat B travels with a velocity of 5 m/s relative to the river at an angle of 60 degrees north of west. What is the magnitude of the velocity of Boat B relative to Boat A?	mcq	medium	physics	general	Class 11	{Relative Velocity}	1	2	true	2025-07-14T02:23:04.250Z	2025-07-14T02:23:04.250Z	{}
6300272f-e142-47e4-9059-c5f235ed4462	Newton's Second Law in Non-Inertial Frames	A block of mass 5 kg is placed on a frictionless floor of an elevator. The elevator is accelerating upwards with an acceleration of 2 m/s². What is the apparent weight of the block as perceived by an observer inside the elevator?	mcq	medium	physics	general	Class 11	{Laws of Motion}	1	2	true	2025-07-14T02:23:04.250Z	2025-07-14T02:23:04.250Z	{}
21d2197a-d446-4967-8b60-5d4d363c6147	Friction and Inclined Plane Analysis	A block of mass 5 kg is placed on a rough inclined plane that makes an angle of 30° with the horizontal. The coefficient of static friction between the block and the plane is 0.4. What is the minimum force parallel to the plane, directed up the incline, required to prevent the block from sliding down?	mcq	medium	physics	general	Class 11	{Friction}	1	2	true	2025-07-14T02:23:04.250Z	2025-07-14T02:23:04.250Z	{}
5a154c7f-ba59-4a20-8bcd-d35a4a6c7fbd	Understanding Centripetal Force in Circular Motion	A car of mass 1200 kg is traveling around a circular track of radius 50 meters at a constant speed of 20 m/s. What is the magnitude of the centripetal force acting on the car?	mcq	medium	physics	general	Class 11	{Circular Motion}	1	2	true	2025-07-14T02:23:04.250Z	2025-07-14T02:23:04.250Z	{}
eecbe552-cc97-4e98-a01b-d63386b7e759	Understanding the Conservation of Mechanical Energy	A block of mass 5 kg slides down a frictionless incline that makes an angle of 30 degrees with the horizontal. The block starts from rest at a height of 10 meters. Calculate the speed of the block when it reaches the bottom of the incline.	mcq	medium	physics	general	Class 11	{Work, Energy and Power}	1	2	true	2025-07-14T02:23:04.250Z	2025-07-14T02:23:04.250Z	{}
e369db9c-cdd8-477f-9c0a-bc5eb0036342	The Physics of a Sliding Block	A block of mass 2 kg is placed at the top of a frictionless inclined plane of height 5 meters. It is released from rest and slides down the incline. At the bottom, it collides elastically with another block of mass 3 kg that is initially at rest on a horizontal surface. Assume the collision is perfectly elastic. What is the speed of the 2 kg block just before the collision?	mcq	medium	physics	general	Class 11	{Conservation of Energy}	1	2	true	2025-07-14T02:23:04.250Z	2025-07-14T02:23:04.250Z	{}
832be1e3-97e6-4c69-bfb9-02cfea747be6	Conservation of Momentum in a Two-Body Collision	Two ice skaters, Skater A and Skater B, are initially at rest on a frictionless ice rink. Skater A has a mass of 60 kg and Skater B has a mass of 80 kg. They push off each other and move in opposite directions. If Skater A achieves a velocity of 3 m/s, what is the velocity of Skater B?	mcq	medium	physics	general	Class 11	{Conservation of Momentum}	1	2	true	2025-07-14T02:23:04.250Z	2025-07-14T02:23:04.250Z	{}
d525ed20-569f-487c-8576-a40eb62dcd2b	Understanding Dimensional Analysis	A student is measuring the speed of a wave in a medium. She calculates the speed using the formula v = sqrt(T/μ), where T is the tension in the medium, measured in newtons (N), and μ is the linear mass density, measured in kilograms per meter (kg/m). What is the correct dimension of the speed v?	mcq	medium	physics	general	Class 11	{Units and Measurements}	1	2	true	2025-07-14T02:23:04.250Z	2025-07-14T02:23:04.250Z	{}
fbd56631-935b-4b59-ba6b-d754242282da	Understanding Scalars and Vectors	A car travels 150 km to the north and then 100 km to the east. Which of the following correctly represents the car's resultant displacement from the starting point?	mcq	medium	physics	general	Class 11	{Scalars and Vectors}	1	2	true	2025-07-14T02:23:04.250Z	2025-07-14T02:23:04.250Z	{}
d6647972-c8e6-4558-bca1-d6b587256665	Analyzing Motion from Velocity-Time Graph	A particle moves along a straight line, and its velocity-time graph is shown as a straight line passing through the origin with a positive slope. Which of the following statements about the particle's motion is correct?	mcq	medium	physics	general	Class 11	{Motion in a Straight Line}	1	2	true	2025-07-14T02:23:04.250Z	2025-07-14T02:23:04.250Z	{}
9675d7ce-b173-48db-946e-6ba394ddb96b	Projectile Motion Analysis	A projectile is launched from the ground with an initial velocity of 50 m/s at an angle of 30 degrees above the horizontal. Neglect air resistance. What is the maximum height reached by the projectile?	mcq	medium	physics	general	Class 11	{Motion in a Plane}	1	2	true	2025-07-14T02:23:04.250Z	2025-07-14T02:23:04.250Z	{}
21731d0a-c8d2-4055-8baa-f7a573201ab3	Projectile Motion: Maximum Range on an Inclined Plane	A projectile is launched from the base of a frictionless inclined plane that makes an angle θ with the horizontal. The projectile is launched at an angle α with respect to the inclined plane with an initial speed v₀. Determine the angle α for which the projectile will have the maximum range along the inclined plane.	mcq	medium	physics	general	Class 11	{Projectile Motion}	1	2	true	2025-07-14T02:23:04.250Z	2025-07-14T02:23:04.250Z	{}
b7d553ed-51d8-4b18-a922-c06bb04f84f5	Understanding Relative Velocity in River Crossing	A swimmer is trying to cross a river that flows at 3 m/s from west to east. The width of the river is 60 meters. The swimmer can swim at a speed of 4 m/s relative to the water. If the swimmer aims to reach directly across the river, what angle with respect to the north should the swimmer aim to swim?	mcq	medium	physics	general	Class 11	{Relative Velocity}	1	2	true	2025-07-14T02:23:04.250Z	2025-07-14T02:23:04.250Z	{}
fdcc4913-7c79-4262-8beb-821fb30bc4a9	Understanding Friction and Motion	A block of mass 10 kg is placed on a rough horizontal surface. A horizontal force of 30 N is applied to the block. If the coefficient of static friction between the block and the surface is 0.4 and the coefficient of kinetic friction is 0.3, what will be the acceleration of the block?	mcq	medium	physics	general	Class 11	{Laws of Motion}	1	2	true	2025-07-14T02:23:04.250Z	2025-07-14T02:23:04.250Z	{}
