id	title	content	questionType	difficulty	subject	board	grade	topicTags	marks	timeLimit	isPublished	createdAt	updatedAt	analytics
5d51df88-84e9-44a8-8efb-87e87d926795	Centripetal Force in Circular Motion	A car of mass m is moving in a circular path of radius r at a constant speed v on a flat, frictionless surface. A string is attached to the car and is providing the necessary centripetal force to keep the car in circular motion. If the speed of the car is doubled, what happens to the tension in the string?	mcq	medium	physics	general	Class 11	{Circular Motion}	1	2	true	2025-07-14T02:23:04.259Z	2025-07-14T02:23:04.259Z	{}
45c9824f-bed2-470a-8f64-7611cd6e984b	Work Done by a Variable Force	A block of mass 2 kg is placed on a frictionless horizontal surface. It is acted upon by a variable force F(x) = 3x² N, where x is the position in meters. The block is initially at rest at x = 0 m. What is the work done on the block by the force F(x) as it moves from x = 0 m to x = 2 m?	mcq	medium	physics	general	Class 11	{Work, Energy and Power}	1	2	true	2025-07-14T02:23:04.259Z	2025-07-14T02:23:04.259Z	{}
66c32407-2f38-4d9e-ba50-231d6685c7bf	Conservation of Energy in a Pendulum System	A simple pendulum consists of a mass m attached to a string of length L. It is released from rest at an angle θ₀ from the vertical. Assuming no air resistance and that the potential energy at the lowest point is zero, what is the speed of the mass when the pendulum reaches its lowest point?	mcq	medium	physics	general	Class 11	{Conservation of Energy}	1	2	true	2025-07-14T02:23:04.259Z	2025-07-14T02:23:04.259Z	{}
b4d669ca-88b0-4c53-934f-a39c5a21242d	Conservation of Momentum in a Two-Body Collision	Two ice skaters, Skater A and Skater B, are initially at rest on a frictionless ice rink. Skater A, with a mass of 50 kg, pushes Skater B, who has a mass of 70 kg. As a result, Skater A moves backward with a velocity of 3 m/s. What is the velocity of Skater B after the push?	mcq	medium	physics	general	Class 11	{Conservation of Momentum}	1	2	true	2025-07-14T02:23:04.259Z	2025-07-14T02:23:04.259Z	{}
31137595-c8ec-469d-9362-240a1e382cd3	Understanding Dimensional Analysis	Which of the following physical quantities has the same dimension as energy?	mcq	medium	physics	general	Class 11	{Units and Measurements}	1	2	true	2025-07-14T02:23:04.259Z	2025-07-14T02:23:04.259Z	{}
cb56a0af-b008-43ae-8e3a-079f8d622c18	Understanding Scalars and Vectors	A car travels 100 km east and then 100 km north. What is the total displacement of the car?	mcq	medium	physics	general	Class 11	{Scalars and Vectors}	1	2	true	2025-07-14T02:23:04.259Z	2025-07-14T02:23:04.259Z	{}
8659174c-6233-4897-a32c-1ce3187884c3	Understanding Motion in a Straight Line	A car starts from rest and travels with a constant acceleration along a straight road. After 4 seconds, it covers a distance of 32 meters. What is the magnitude of the car's acceleration?	mcq	medium	physics	general	Class 11	{Motion in a Straight Line}	1	2	true	2025-07-14T02:23:04.259Z	2025-07-14T02:23:04.259Z	{}
a7852abd-9094-427b-b551-f46faabfce9b	Projectile Motion Analysis	A projectile is launched from the ground with an initial speed of 20 m/s at an angle of 30 degrees with respect to the horizontal. Assuming no air resistance, what is the time of flight of the projectile?	mcq	medium	physics	general	Class 11	{Motion in a Plane}	1	2	true	2025-07-14T02:23:04.259Z	2025-07-14T02:23:04.259Z	{}
3cc23fb8-ba21-4689-8965-ede0867b2fac	Projectile Motion: Time of Flight and Range	A projectile is launched from ground level with an initial speed of 50 m/s at an angle of 30 degrees above the horizontal. Assuming no air resistance, what is the total time of flight for the projectile?	mcq	medium	physics	general	Class 11	{Projectile Motion}	1	2	true	2025-07-14T02:23:04.259Z	2025-07-14T02:23:04.259Z	{}
8ae8c221-d4ee-4606-b341-a14e93044e8d	Relative Velocity in a River Crossing Scenario	A swimmer wants to cross a river that flows due east at a speed of 3 m/s. The swimmer can maintain a speed of 4 m/s relative to the water and aims to reach a point directly north on the opposite bank. What should be the swimmer's direction with respect to the north to achieve this?	mcq	medium	physics	general	Class 11	{Relative Velocity}	1	2	true	2025-07-14T02:23:04.259Z	2025-07-14T02:23:04.259Z	{}
4d52ddd7-91e9-4c93-81b5-61a93c1ea0a4	Understanding Frictional Forces	A block of mass 5 kg is placed on a rough horizontal surface. A horizontal force of 20 N is applied to the block, but it does not move. If the coefficient of static friction between the block and the surface is 0.6, what is the magnitude of the frictional force acting on the block?	mcq	medium	physics	general	Class 11	{Laws of Motion}	1	2	true	2025-07-14T02:23:04.259Z	2025-07-14T02:23:04.259Z	{}
8c74bbe1-c354-4cda-9af9-b602e6070cd0	Friction on an Inclined Plane	A block of mass 5 kg is placed on a rough inclined plane that makes an angle of 30 degrees with the horizontal. The coefficient of static friction between the block and the plane is 0.4. What is the minimum force parallel to the incline that needs to be applied to the block to prevent it from sliding down?	mcq	medium	physics	general	Class 11	{Friction}	1	2	true	2025-07-14T02:23:04.259Z	2025-07-14T02:23:04.259Z	{}
0443fa9a-2a04-444d-a1b4-ac8b80d12c6c	Understanding Tension in Circular Motion	A small object of mass m is attached to a string and is being whirled in a vertical circle of radius R at a constant speed v. At the topmost point of the circle, what is the tension in the string?	mcq	medium	physics	general	Class 11	{Circular Motion}	1	2	true	2025-07-14T02:23:04.260Z	2025-07-14T02:23:04.260Z	{}
5137126c-9990-453d-ab81-fa6a35f1cd46	Understanding Work-Energy Principle	A block of mass 2 kg is initially at rest on a frictionless horizontal surface. A constant horizontal force of magnitude 10 N is applied to the block, causing it to move. How much work is done by the force on the block by the time it has moved 3 meters?	mcq	medium	physics	general	Class 11	{Work, Energy and Power}	1	2	true	2025-07-14T02:23:04.260Z	2025-07-14T02:23:04.260Z	{}
0fd6906d-a70d-4b8d-b2bd-c2e4dc836329	Conservation of Energy in a Pendulum System	A simple pendulum consists of a small bob of mass m attached to a lightweight, inextensible string of length L. The pendulum is released from rest at an angle θ_0 from the vertical. Assuming no air resistance or friction, what is the speed of the bob at its lowest point?	mcq	medium	physics	general	Class 11	{Conservation of Energy}	1	2	true	2025-07-14T02:23:04.260Z	2025-07-14T02:23:04.260Z	{}
e7faf1c6-c8ec-48e5-8b87-86f2ceff1981	Collision Between Two Gliders on a Frictionless Air Track	Two gliders, Glider A and Glider B, are on a frictionless air track. Glider A has a mass of 0.5 kg and is moving to the right with a velocity of 2 m/s. Glider B has a mass of 0.5 kg and is initially at rest. After an elastic collision, Glider A moves to the left with a velocity of 1 m/s. What is the velocity of Glider B after the collision?	mcq	medium	physics	general	Class 11	{Conservation of Momentum}	1	2	true	2025-07-14T02:23:04.260Z	2025-07-14T02:23:04.260Z	{}
20a93c88-0bc5-4bb0-8e4a-81774dd61455	Understanding Dimensional Analysis	A scientist is studying a new physical phenomenon and proposes a formula for a quantity X that involves a velocity v, a mass m, and a time t. The formula proposed is X = k * v^a * m^b * t^c, where k is a dimensionless constant. Given that X is supposed to have the dimensions of force, which of the following sets of values for a, b, and c is consistent with this requirement?	mcq	medium	physics	general	Class 11	{Units and Measurements}	1	2	true	2025-07-14T02:23:04.260Z	2025-07-14T02:23:04.260Z	{}
7c93e49e-d592-4e48-8cc7-968d61201883	Understanding Scalars and Vectors	A car travels 60 km north, then 60 km east. What is the magnitude of the car's resultant displacement?	mcq	medium	physics	general	Class 11	{Scalars and Vectors}	1	2	true	2025-07-14T02:23:04.260Z	2025-07-14T02:23:04.260Z	{}
37ac8652-8812-474c-a71d-b555ee27908d	Displacement Analysis of a Particle in Uniform Motion	A particle moves along a straight line with a constant velocity of 5 m/s. If the particle starts from a position of -10 meters at time t = 0 seconds, what is the position of the particle at t = 8 seconds?	mcq	medium	physics	general	Class 11	{Motion in a Straight Line}	1	2	true	2025-07-14T02:23:04.260Z	2025-07-14T02:23:04.260Z	{}
c1df526a-3410-41ff-a70e-51f541494525	Projectile Motion and Initial Speed	A projectile is launched from the ground with an initial speed v_0 at an angle θ above the horizontal. Neglecting air resistance, which of the following expressions correctly represents the maximum height H reached by the projectile?	mcq	medium	physics	general	Class 11	{Motion in a Plane}	1	2	true	2025-07-14T02:23:04.260Z	2025-07-14T02:23:04.260Z	{}
feb10b69-b6b2-4cdf-bc5c-b1f6be65bbbe	Projectile Motion: Maximum Range Calculation	A projectile is launched from the ground with an initial speed of 20 m/s at an angle θ with the horizontal. Assuming no air resistance, at what angle θ should the projectile be launched to achieve maximum range?	mcq	medium	physics	general	Class 11	{Projectile Motion}	1	2	true	2025-07-14T02:23:04.260Z	2025-07-14T02:23:04.260Z	{}
309f6d32-370f-4fad-a28d-e955bad67d65	Relative Velocity in Two Dimensions	A bird is flying north at a speed of 10 m/s relative to the air. Meanwhile, the wind is blowing east at 5 m/s. What is the bird's velocity relative to the ground?	mcq	medium	physics	general	Class 11	{Relative Velocity}	1	2	true	2025-07-14T02:23:04.260Z	2025-07-14T02:23:04.260Z	{}
4e6bd973-1665-47f1-a950-17f89069aae5	Understanding Friction and Motion	A block of mass 5 kg is placed on a rough horizontal surface with a coefficient of static friction μs = 0.4. A horizontal force F is gradually applied to the block. What is the minimum value of F required to start moving the block?	mcq	medium	physics	general	Class 11	{Laws of Motion}	1	2	true	2025-07-14T02:23:04.260Z	2025-07-14T02:23:04.260Z	{}
139f4601-ad57-4994-9bb0-121351c8945d	Friction on an Inclined Plane	A block of mass 5 kg is placed on a rough inclined plane that makes an angle of 30° with the horizontal. The coefficient of static friction between the block and the plane is 0.5. What is the minimum force parallel to the plane required to start moving the block up the incline?	mcq	medium	physics	general	Class 11	{Friction}	1	2	true	2025-07-14T02:23:04.260Z	2025-07-14T02:23:04.260Z	{}
d56ade7f-da83-4a04-aa58-921231a350ca	Dynamics of Circular Motion	A small object of mass m is attached to one end of a light, inextensible string of length L. It is being whirled in a horizontal circle at a constant speed v. The other end of the string is fixed at point O, which is at the same height as the circle. If the string makes an angle θ with the vertical, what is the tension T in the string?	mcq	medium	physics	general	Class 11	{Circular Motion}	1	2	true	2025-07-14T02:23:04.260Z	2025-07-14T02:23:04.260Z	{}
b183165d-e2bb-40c7-8950-ed574d61286f	Understanding Work-Energy Theorem	A block of mass 2 kg is initially at rest on a frictionless horizontal surface. A constant horizontal force of 10 N is applied to the block, causing it to move. After the block has traveled a distance of 5 meters, what is the kinetic energy of the block?	mcq	medium	physics	general	Class 11	{Work, Energy and Power}	1	2	true	2025-07-14T02:23:04.260Z	2025-07-14T02:23:04.260Z	{}
0a8a1f67-ebac-46ad-8214-11d6cd74b100	Conservation of Energy in a Pendulum System	A pendulum of length L is released from a height h (where h < L) with respect to its lowest point. Assuming there is no air resistance and the pivot is frictionless, what is the speed of the pendulum bob at its lowest point?	mcq	medium	physics	general	Class 11	{Conservation of Energy}	1	2	true	2025-07-14T02:23:04.260Z	2025-07-14T02:23:04.260Z	{}
d5e1ab2f-fbd9-4f4f-a497-130e98ab7d49	Conservation of Momentum in a Two-Body Collision	Two ice skaters, Skater A with a mass of 50 kg and Skater B with a mass of 75 kg, are initially at rest on a frictionless ice rink. They push off against each other, causing Skater A to move with a velocity of 3 m/s to the right. Assuming no external forces act on the system, what is the velocity of Skater B after the push?	mcq	medium	physics	general	Class 11	{Conservation of Momentum}	1	2	true	2025-07-14T02:23:04.261Z	2025-07-14T02:23:04.261Z	{}
81b16bba-d197-416b-a0fe-5a68ba31fa4f	Understanding Dimensional Analysis	A particular equation in physics is given by \( F = k \cdot x^n \cdot t^m \), where \( F \) is force with dimensions \([M \cdot L \cdot T^{-2} ]\), \( x \) is distance with dimensions \([L]\), \( t \) is time with dimensions \([T]\), and \( k \) is a dimensionless constant. What are the values of \( n \) and \( m \) such that the equation is dimensionally consistent?	mcq	medium	physics	general	Class 11	{Units and Measurements}	1	2	true	2025-07-14T02:23:04.261Z	2025-07-14T02:23:04.261Z	{}
604ed872-b05a-479f-ac8b-90fd6e444ba9	Understanding Scalars and Vectors	Which one of the following statements accurately distinguishes a scalar quantity from a vector quantity?	mcq	medium	physics	general	Class 11	{Scalars and Vectors}	1	2	true	2025-07-14T02:23:04.261Z	2025-07-14T02:23:04.261Z	{}
77b5928e-3f52-4650-811a-5074afb43216	Velocity and Time Relationship	A car moves along a straight road with an initial velocity of 10 m/s. It accelerates uniformly at a rate of 2 m/s² for 5 seconds. What is the final velocity of the car after this time period?	mcq	medium	physics	general	Class 11	{Motion in a Straight Line}	1	2	true	2025-07-14T02:23:04.261Z	2025-07-14T02:23:04.261Z	{}
0422393f-423c-4319-837b-afa906a335e9	Projectile Motion and Relative Velocity	A bird flies with a constant speed of 10 m/s due north relative to the air. There is a wind blowing from the west at 5 m/s. Calculate the magnitude of the bird's velocity relative to the ground.	mcq	medium	physics	general	Class 11	{Motion in a Plane}	1	2	true	2025-07-14T02:23:04.261Z	2025-07-14T02:23:04.261Z	{}
427164fe-61eb-47f3-b960-87e10eacbd34	Projectile Motion - Optimal Launch Angle	A projectile is launched from ground level with an initial speed of 30 m/s. Assuming no air resistance, which launch angle will result in the maximum horizontal distance traveled by the projectile?	mcq	medium	physics	general	Class 11	{Projectile Motion}	1	2	true	2025-07-14T02:23:04.261Z	2025-07-14T02:23:04.261Z	{}
3c450d97-3ee6-448e-b4f2-525512598d33	Relative Velocity in River Crossing	A swimmer wants to cross a river that flows eastward at a velocity of 3 m/s. The swimmer can swim with a velocity of 5 m/s relative to the water. If the swimmer aims to reach directly across to the opposite bank, what angle relative to the north should the swimmer head?	mcq	medium	physics	general	Class 11	{Relative Velocity}	1	2	true	2025-07-14T02:23:04.261Z	2025-07-14T02:23:04.261Z	{}
10edbd03-95b6-4fc7-8d45-8cea7a0a0943	Understanding Newton's Third Law	Two ice skaters, Skater A and Skater B, are standing still on a frictionless ice rink. Skater A pushes Skater B with a force of 50 N. According to Newton's Third Law of Motion, what is the magnitude of the force that Skater B exerts on Skater A?	mcq	medium	physics	general	Class 11	{Laws of Motion}	1	2	true	2025-07-14T02:23:04.261Z	2025-07-14T02:23:04.261Z	{}
ebae36e5-d6ad-443f-a056-e50a3e1df8a2	Understanding Kinetic Friction on an Inclined Plane	A block of mass 5 kg is placed on a rough inclined plane making an angle of 30 degrees with the horizontal. The coefficient of kinetic friction between the block and the plane is 0.4. The block is initially at rest and is then given a small push to start sliding down the plane. Calculate the acceleration of the block as it slides down. Assume g = 9.8 m/s².	mcq	medium	physics	general	Class 11	{Friction}	1	2	true	2025-07-14T02:23:04.261Z	2025-07-14T02:23:04.261Z	{}
0c89de41-0a42-43fe-b486-beed46ccabef	Centripetal Force in Circular Motion	A car of mass 1200 kg is moving at a constant speed of 20 m/s around a flat circular track with a radius of 50 meters. What is the magnitude of the centripetal force acting on the car?	mcq	medium	physics	general	Class 11	{Circular Motion}	1	2	true	2025-07-14T02:23:04.261Z	2025-07-14T02:23:04.261Z	{}
e502ef06-20a3-4028-8289-b9ef6e559519	Energy Transformation on an Inclined Plane	A block of mass m is released from rest at the top of a frictionless inclined plane of height h and length L. At the bottom of the incline, the block compresses a spring with spring constant k by a distance x before coming to rest. Which of the following expressions correctly represents the relationship between the gravitational potential energy at the top and the spring potential energy at the bottom?	mcq	medium	physics	general	Class 11	{Work, Energy and Power}	1	2	true	2025-07-14T02:23:04.261Z	2025-07-14T02:23:04.261Z	{}
395a3b24-afe7-4fc1-9959-85d291d3e616	Conservation of Energy in a Pendulum System	A pendulum consists of a small ball of mass m attached to a string of length L. The pendulum is released from rest at a height h above its lowest point of swing. Assuming no air resistance and that the string is massless and inextensible, what is the speed of the ball at the lowest point of its swing?	mcq	medium	physics	general	Class 11	{Conservation of Energy}	1	2	true	2025-07-14T02:23:04.261Z	2025-07-14T02:23:04.261Z	{}
444ee99e-520a-4fac-be4c-fb7fa457dc09	Conservation of Momentum in a Two-Body Collision	Two ice skaters, Skater A and Skater B, are initially at rest on a frictionless ice rink. Skater A has a mass of 60 kg, and Skater B has a mass of 80 kg. They push off each other and move in opposite directions. If Skater A acquires a velocity of 3 m/s, what is the velocity of Skater B?	mcq	medium	physics	general	Class 11	{Conservation of Momentum}	1	2	true	2025-07-14T02:23:04.261Z	2025-07-14T02:23:04.261Z	{}
29b16d31-a32c-4bc4-850b-5377b5103884	Precision in Measurements	In an experiment, a student measures the length of a metallic rod using a meter scale and records a value of 1.234 m. The scale has a least count of 0.001 m. Which of the following statements about the measurement is correct?	mcq	medium	physics	general	Class 11	{Units and Measurements}	1	2	true	2025-07-14T02:23:04.261Z	2025-07-14T02:23:04.261Z	{}
87bffe01-d2c1-4080-81c8-88da945ff976	Understanding Scalars and Vectors	A student is analyzing a series of physical quantities to determine which of them are vectors. She lists down force, mass, temperature, and displacement. Which of the following statements is correct regarding these quantities?	mcq	medium	physics	general	Class 11	{Scalars and Vectors}	1	2	true	2025-07-14T02:23:04.261Z	2025-07-14T02:23:04.261Z	{}
33e36fc5-8f2c-4b1f-a3f8-dd1306901558	Analyzing Motion in a Straight Line	A car accelerates uniformly along a straight road. Initially, it is at rest at point A. After 10 seconds, it passes point B, which is 100 meters away from point A. What is the acceleration of the car?	mcq	medium	physics	general	Class 11	{Motion in a Straight Line}	1	2	true	2025-07-14T02:23:04.261Z	2025-07-14T02:23:04.261Z	{}
1bcb7a34-d7ef-48bb-9d8d-6050092b3bf6	Projectile Motion and Time of Flight	A projectile is launched from the ground with an initial speed of 20 m/s at an angle of 30° above the horizontal. Assume there is no air resistance. What is the total time of flight of the projectile before it hits the ground?	mcq	medium	physics	general	Class 11	{Motion in a Plane}	1	2	true	2025-07-14T02:23:04.261Z	2025-07-14T02:23:04.261Z	{}
52b9ba79-922e-4ed9-82fe-0b54e281d2d1	Projectile Motion: Maximum Height	A projectile is launched from the ground with an initial speed of 20 m/s at an angle of 30° above the horizontal. Assuming no air resistance, what is the maximum height reached by the projectile?	mcq	medium	physics	general	Class 11	{Projectile Motion}	1	2	true	2025-07-14T02:23:04.261Z	2025-07-14T02:23:04.261Z	{}
0849dbb5-0443-4f8e-a56b-5d2bdc14eaa2	Relative Velocity and Crossing a River	A boat is attempting to cross a river that flows with a velocity of 5 m/s relative to the shore. The boat's speed in still water is 10 m/s. If the boat is pointed directly across the river, what is the resultant velocity of the boat relative to an observer on the shore?	mcq	medium	physics	general	Class 11	{Relative Velocity}	1	2	true	2025-07-14T02:23:04.261Z	2025-07-14T02:23:04.261Z	{}
35d0b7d2-a9b0-4517-8af1-34a5c962a375	Understanding Newton's Third Law	Two ice skaters, Skater A and Skater B, are initially at rest on a frictionless ice surface. Skater A pushes Skater B, causing both to move in opposite directions. If Skater A has a mass of 50 kg and Skater B has a mass of 70 kg, and after the push, Skater B moves with a velocity of 2 m/s, what is the velocity of Skater A?	mcq	medium	physics	general	Class 11	{Laws of Motion}	1	2	true	2025-07-14T02:23:04.261Z	2025-07-14T02:23:04.261Z	{}
230b66d9-59f8-4b9b-9b7e-11676fdbeac0	Understanding Kinetic Friction on an Inclined Plane	A block of mass 5 kg is placed on an inclined plane that makes an angle of 30° with the horizontal. The coefficient of kinetic friction between the block and the plane is 0.3. If the block is released from rest, what is the acceleration of the block down the incline? (Assume g = 9.8 m/s².)	mcq	medium	physics	general	Class 11	{Friction}	1	2	true	2025-07-14T02:23:04.261Z	2025-07-14T02:23:04.261Z	{}
690e1e1e-ac8b-44ee-add0-5232d3c42197	Understanding Centripetal Force in Circular Motion	A car of mass 1200 kg is taking a turn on a circular track of radius 50 meters at a constant speed of 20 m/s. What is the magnitude of the net centripetal force acting on the car?	mcq	medium	physics	general	Class 11	{Circular Motion}	1	2	true	2025-07-14T02:23:04.261Z	2025-07-14T02:23:04.261Z	{}
3461d515-a01c-4580-931c-bd1777d3793c	Work Done by a Variable Force	A particle moves along the x-axis under the influence of a variable force given by F(x) = 3x^2 + 2x (in Newtons), where x is in meters. Calculate the work done by this force as the particle moves from x = 1 m to x = 3 m.	mcq	medium	physics	general	Class 11	{Work, Energy and Power}	1	2	true	2025-07-14T02:23:04.261Z	2025-07-14T02:23:04.261Z	{}
69770c05-1d0c-4940-b647-0b221f9608c3	Conservation of Energy in a Pendulum System	A simple pendulum consists of a small spherical bob of mass m attached to a light, inextensible string of length L. The pendulum is released from rest at an angle θ₀ with the vertical. Assuming no air resistance and that the only force acting is gravity, what is the speed of the bob at its lowest point?	mcq	medium	physics	general	Class 11	{Conservation of Energy}	1	2	true	2025-07-14T02:23:04.262Z	2025-07-14T02:23:04.262Z	{}
3160648b-4da3-4d32-a008-a7895f35b5fc	Conservation of Momentum in an Inelastic Collision	Two ice skaters, initially at rest, push off against each other on a frictionless ice surface. Skater A has a mass of 50 kg and skater B has a mass of 70 kg. After the push, skater A moves with a velocity of 2 m/s to the east. What is the velocity of skater B after the push?	mcq	medium	physics	general	Class 11	{Conservation of Momentum}	1	2	true	2025-07-14T02:23:04.262Z	2025-07-14T02:23:04.262Z	{}
04814df9-0859-4921-9418-036f0d11e380	Understanding Dimensional Analysis	A researcher is conducting an experiment and needs to derive a new physical quantity 'X' based on the relationship X = (F * v) / (E * t), where F is force, v is velocity, E is energy, and t is time. Which of the following options correctly represents the dimensional formula of the quantity 'X'?	mcq	medium	physics	general	Class 11	{Units and Measurements}	1	2	true	2025-07-14T02:23:04.262Z	2025-07-14T02:23:04.262Z	{}
3e9fe57d-f4e0-4415-bb3d-739ba21989ec	Scalars and Vectors: Analyzing Displacement	A hiker walks 3 km due north and then 4 km due east. Determine the magnitude of the hiker's resultant displacement vector from the starting point.	mcq	medium	physics	general	Class 11	{Scalars and Vectors}	1	2	true	2025-07-14T02:23:04.262Z	2025-07-14T02:23:04.262Z	{}
575a2ad6-bd36-4b1d-aaad-66f2091e54cc	Motion in a Straight Line: Analyzing Acceleration	A car starts from rest and travels along a straight road. The car accelerates uniformly at a rate of 2 m/s² for 5 seconds, then continues at a constant speed for the next 10 seconds. Finally, the car decelerates uniformly to a stop in 3 seconds. What is the total distance traveled by the car?	mcq	medium	physics	general	Class 11	{Motion in a Straight Line}	1	2	true	2025-07-14T02:23:04.262Z	2025-07-14T02:23:04.262Z	{}
a340b730-682f-41a5-b5ad-d28b5a6e5f84	Projectile Motion	A projectile is launched with an initial velocity of 20 m/s at an angle of 30 degrees above the horizontal from the top of a 45-meter high cliff. Assuming acceleration due to gravity is 9.8 m/s² and there is no air resistance, what is the horizontal distance traveled by the projectile when it hits the ground?	mcq	medium	physics	general	Class 11	{Motion in a Plane}	1	2	true	2025-07-14T02:23:04.262Z	2025-07-14T02:23:04.262Z	{}
bb5298fb-8e3e-419d-883e-2e3a4771166b	Projectile Motion and Maximum Height	A projectile is launched from the ground with an initial speed of 50 m/s at an angle of 37 degrees above the horizontal. Assuming no air resistance, what is the maximum height reached by the projectile?	mcq	medium	physics	general	Class 11	{Projectile Motion}	1	2	true	2025-07-14T02:23:04.262Z	2025-07-14T02:23:04.262Z	{}
21d5fa66-a5ee-41ea-a96b-b79dbe72c03a	Analyzing Relative Velocity in a River	A swimmer is attempting to cross a river that flows from west to east with a current velocity of 3 m/s. The swimmer can maintain a speed of 4 m/s relative to the water. The swimmer aims to reach directly across to a point on the opposite bank due north of the starting point. What should be the swimmer's heading relative to the north to achieve this goal?	mcq	medium	physics	general	Class 11	{Relative Velocity}	1	2	true	2025-07-14T02:23:04.262Z	2025-07-14T02:23:04.262Z	{}
