id	title	content	questionType	difficulty	subject	board	grade	topicTags	marks	timeLimit	isPublished	createdAt	updatedAt	analytics
45c4e20a-68b5-4be6-bb6e-666cec323bdb	Conservation of Energy in a Frictionless Roller Coaster	A roller coaster car of mass 500 kg is released from rest at the top of a frictionless track. The car starts from a height of 50 meters above the ground. Assuming no frictional losses, what is the speed of the car when it reaches a point 20 meters above the ground?	mcq	medium	physics	general	Class 11	{Conservation of Energy}	1	2	true	2025-07-14T02:23:04.240Z	2025-07-14T02:23:04.240Z	{}
74957e43-ef0e-4f54-8747-4e1e52145475	Conservation of Momentum in a Two-Dimensional Collision	Two ice skaters, Skater A and Skater B, are initially at rest on a frictionless ice rink. Skater A, with a mass of 50 kg, pushes off Skater B, who has a mass of 70 kg. After the push, Skater A moves with a velocity of 3 m/s to the east. What is the velocity of Skater B after the push?	mcq	medium	physics	general	Class 11	{Conservation of Momentum}	1	2	true	2025-07-14T02:23:04.240Z	2025-07-14T02:23:04.240Z	{}
b13fc8e1-d742-4238-a47a-f604d87635fe	Understanding Unit Conversion in Mechanics	A car travels a distance of 150 kilometers at a speed of 75 kilometers per hour. How long does the journey take if the speed is converted to meters per second? (1 kilometer = 1000 meters, 1 hour = 3600 seconds)	mcq	medium	physics	general	Class 11	{Units and Measurements}	1	2	true	2025-07-14T02:23:04.240Z	2025-07-14T02:23:04.240Z	{}
ddf543bd-e2ac-4563-97af-73532bfe22f6	Understanding Scalars and Vectors	Consider two vectors **A** and **B** in a plane, where **A** has a magnitude of 5 units and is oriented 30 degrees above the positive x-axis, and **B** has a magnitude of 10 units and is oriented 60 degrees above the positive x-axis. Which of the following is the correct magnitude of the resultant vector **R = A + B**?	mcq	medium	physics	general	Class 11	{Scalars and Vectors}	1	2	true	2025-07-14T02:23:04.240Z	2025-07-14T02:23:04.240Z	{}
d9afba2c-3640-4515-8628-f78832a8eb53	Analyzing Motion with Constant Acceleration	A car accelerates from rest along a straight road with a constant acceleration of 2 m/s². After traveling for 10 seconds, the driver suddenly applies the brakes, producing a constant deceleration of 4 m/s². How far does the car travel from the start until it comes to a complete stop?	mcq	medium	physics	general	Class 11	{Motion in a Straight Line}	1	2	true	2025-07-14T02:23:04.240Z	2025-07-14T02:23:04.240Z	{}
156c6976-7577-4cd4-a33f-b2713325c95b	Projectile Motion Analysis	A projectile is launched from the ground with an initial speed of 20 m/s at an angle of 30 degrees above the horizontal. Assuming no air resistance, what is the maximum height reached by the projectile?	mcq	medium	physics	general	Class 11	{Motion in a Plane}	1	2	true	2025-07-14T02:23:04.240Z	2025-07-14T02:23:04.240Z	{}
e8731e40-c40d-45df-b228-445e4591036e	Projectile Motion: Maximum Range	A soccer player kicks a ball with an initial velocity of 20 m/s at an angle θ to the horizontal. Assuming the ball lands at the same vertical height from which it was kicked and ignoring air resistance, what angle θ will result in the maximum horizontal range of the ball?	mcq	medium	physics	general	Class 11	{Projectile Motion}	1	2	true	2025-07-14T02:23:04.241Z	2025-07-14T02:23:04.241Z	{}
7f9d5fe9-6452-424e-bfa5-3ed8d730b732	Understanding Relative Velocity on a Moving Train	A passenger is standing inside a train that is moving at a constant velocity of 30 m/s towards the east. The passenger throws a ball with a velocity of 20 m/s relative to the train towards the west. Assume no air resistance. What is the velocity of the ball with respect to an observer standing on the ground?	mcq	medium	physics	general	Class 11	{Relative Velocity}	1	2	true	2025-07-14T02:23:04.241Z	2025-07-14T02:23:04.241Z	{}
4bb02e9b-8400-4bb6-9c8e-85ff25ea7944	Understanding Tension in an Accelerating System	A block of mass 5 kg is placed on a frictionless horizontal surface and connected by a light, inextensible string passing over a frictionless pulley to another block of mass 3 kg hanging vertically. The system is released from rest. What is the tension in the string?	mcq	medium	physics	general	Class 11	{Laws of Motion}	1	2	true	2025-07-14T02:23:04.241Z	2025-07-14T02:23:04.241Z	{}
02a56297-849e-4323-b0a0-427b0bfa0b15	Understanding the Coefficient of Kinetic Friction	A block of mass 10 kg is placed on a horizontal surface. A horizontal force of 50 N is applied to the block, causing it to move at a constant velocity. What is the coefficient of kinetic friction between the block and the surface?	mcq	medium	physics	general	Class 11	{Friction}	1	2	true	2025-07-14T02:23:04.241Z	2025-07-14T02:23:04.241Z	{}
d3145b41-45d3-4a8c-a7b9-eb248d4dc87f	Analyzing Forces in Circular Motion	A car of mass 1200 kg is moving with a constant speed of 15 m/s along a circular track of radius 50 meters. What is the magnitude of the net force acting on the car that keeps it in circular motion?	mcq	medium	physics	general	Class 11	{Circular Motion}	1	2	true	2025-07-14T02:23:04.241Z	2025-07-14T02:23:04.241Z	{}
1876daa5-857f-4900-a923-765a55c3cf5b	Work, Energy, and Power: Kinetic Energy Change	A 5 kg object is initially at rest on a frictionless horizontal surface. A constant horizontal force of 10 N is applied to the object. What is the kinetic energy of the object after 4 seconds?	mcq	medium	physics	general	Class 11	{Work, Energy and Power}	1	2	true	2025-07-14T02:23:04.241Z	2025-07-14T02:23:04.241Z	{}
dcd7db3b-cd0e-4980-8a80-22be30d397da	Conservation of Energy in a Pendulum System	A pendulum consists of a small bob of mass m, suspended from a fixed point by a string of length L. The pendulum is released from a height h above its lowest point, where the string is taut and horizontal. Assuming no air resistance and that the pendulum undergoes simple harmonic motion, what is the speed of the bob at its lowest point?	mcq	medium	physics	general	Class 11	{Conservation of Energy}	1	2	true	2025-07-14T02:23:04.241Z	2025-07-14T02:23:04.241Z	{}
b6bbd1af-3c79-49c0-94df-625974f5ec81	Collision and Conservation of Momentum	Two ice skaters, initially at rest, push off from each other on a frictionless ice surface. Skater A has a mass of 60 kg, and Skater B has a mass of 80 kg. After the push, Skater A moves with a velocity of 3 m/s to the left. What is the velocity of Skater B?	mcq	medium	physics	general	Class 11	{Conservation of Momentum}	1	2	true	2025-07-14T02:23:04.241Z	2025-07-14T02:23:04.241Z	{}
a66298cc-b10b-4e6b-b833-37db0f69acaf	Understanding Dimensional Analysis	A physicist is conducting an experiment to measure the acceleration due to gravity on a newly discovered planet. She uses a simple pendulum for her measurements. If the period of the pendulum is given by T = 2π√(L/g), where T is the period, L is the length of the pendulum, and g is the acceleration due to gravity, what is the correct dimensional formula for the gravitational acceleration g?	mcq	medium	physics	general	Class 11	{Units and Measurements}	1	2	true	2025-07-14T02:23:04.241Z	2025-07-14T02:23:04.241Z	{}
7887e420-b941-4ec5-afee-a877f0849b62	Understanding Scalars and Vectors	In a physics experiment, a student walks 3 km north, then 4 km east, and finally 2 km south. Which of the following is the correct representation of the student's resultant displacement vector from the starting point?	mcq	medium	physics	general	Class 11	{Scalars and Vectors}	1	2	true	2025-07-14T02:23:04.241Z	2025-07-14T02:23:04.241Z	{}
11636d79-181e-47cf-9ce0-d83980c2152c	Analyzing Motion with Constant Acceleration	A car accelerates uniformly from rest along a straight road. After traveling a distance of 100 meters, it reaches a speed of 20 m/s. What is the magnitude of the car's acceleration?	mcq	medium	physics	general	Class 11	{Motion in a Straight Line}	1	2	true	2025-07-14T02:23:04.241Z	2025-07-14T02:23:04.241Z	{}
841a19a9-2349-4117-a45f-de8ea42fb483	Projectile Motion and Initial Velocity	A ball is thrown from the top of a cliff with an initial velocity that makes an angle of 30 degrees with the horizontal. The ball lands on the ground 50 meters horizontally away from the base of the cliff. Assuming negligible air resistance, what is the initial speed of the ball? (Use g = 9.8 m/s² and assume the vertical displacement from top of the cliff to the ground is 0 for this calculation)	mcq	medium	physics	general	Class 11	{Motion in a Plane}	1	2	true	2025-07-14T02:23:04.241Z	2025-07-14T02:23:04.241Z	{}
6e93bfa6-24e6-47fa-9e2a-9dd3ea7e2419	Projectile Motion: Maximum Height and Range Relationship	A projectile is launched from the ground with an initial speed v_0 at an angle θ with respect to the horizontal. Assuming no air resistance, which of the following statements is true about the maximum height (H) and the range (R) of the projectile?	mcq	medium	physics	general	Class 11	{Projectile Motion}	1	2	true	2025-07-14T02:23:04.241Z	2025-07-14T02:23:04.241Z	{}
7681c147-b358-4eca-821f-ca7b985ca099	Relative Velocity in a River	A swimmer is trying to cross a river that flows with a uniform velocity of 3 m/s towards the east. The swimmer can swim with a velocity of 4 m/s relative to the water. If the swimmer aims directly north, what will be their resultant velocity relative to an observer on the riverbank?	mcq	medium	physics	general	Class 11	{Relative Velocity}	1	2	true	2025-07-14T02:23:04.241Z	2025-07-14T02:23:04.241Z	{}
1d5fc9d1-3e62-4497-b36a-2ef70db1b0cc	Understanding Newton's Third Law	A hockey player strikes a puck with his stick, exerting a force of 150 N on the puck. According to Newton's third law, the puck exerts an equal and opposite force on the stick. If the puck is initially at rest on a frictionless surface, what is the acceleration of the puck immediately after being struck, assuming its mass is 0.2 kg?	mcq	medium	physics	general	Class 11	{Laws of Motion}	1	2	true	2025-07-14T02:23:04.241Z	2025-07-14T02:23:04.241Z	{}
c1e39b78-2519-45c3-a936-bda3680c2703	Understanding Friction on an Inclined Plane	A block of mass 5 kg is placed on a rough inclined plane that makes an angle of 30 degrees with the horizontal. The coefficient of static friction between the block and the inclined plane is 0.4. What is the minimum force parallel to the plane required to prevent the block from sliding down?	mcq	medium	physics	general	Class 11	{Friction}	1	2	true	2025-07-14T02:23:04.241Z	2025-07-14T02:23:04.241Z	{}
3278ae22-dc47-4242-9282-eb6fb6ab6ae6	Understanding Centripetal Force in Circular Motion	A car of mass 1200 kg is navigating a flat circular track with a radius of 50 meters at a constant speed of 20 m/s. Assuming no frictional losses and that the only force acting towards the center is the frictional force between the tires and the track, what is the magnitude of the frictional force necessary to keep the car in circular motion?	mcq	medium	physics	general	Class 11	{Circular Motion}	1	2	true	2025-07-14T02:23:04.241Z	2025-07-14T02:23:04.241Z	{}
33e402d8-4e44-4ef7-8127-1da576c1108d	Work and Potential Energy in a Spring System	A block of mass 2 kg is attached to a horizontal spring with a spring constant of 100 N/m. The block is initially at rest at the spring's equilibrium position. A constant force of 10 N is then applied horizontally to the block, stretching the spring. What is the work done by this force when the spring is stretched by 0.5 meters?	mcq	medium	physics	general	Class 11	{Work, Energy and Power}	1	2	true	2025-07-14T02:23:04.241Z	2025-07-14T02:23:04.241Z	{}
8e47ed05-9969-461d-8d1d-a24a849d4089	Conservation of Energy in a Pendulum System	A simple pendulum consists of a small spherical bob of mass m attached to a string of length L. The bob is released from rest at an angle θ_0 from the vertical. Assuming no air resistance and that the pivot is frictionless, which of the following statements about the energy of the system at the lowest point of its swing is correct?	mcq	medium	physics	general	Class 11	{Conservation of Energy}	1	2	true	2025-07-14T02:23:04.241Z	2025-07-14T02:23:04.241Z	{}
f46f2291-2ac0-4d9c-bdf3-2891773e291f	Conservation of Momentum in an Elastic Collision	Two identical billiard balls of mass m are moving towards each other with the same speed v on a frictionless table. They collide elastically and then move apart. What is the speed of each ball after the collision?	mcq	medium	physics	general	Class 11	{Conservation of Momentum}	1	2	true	2025-07-14T02:23:04.241Z	2025-07-14T02:23:04.241Z	{}
f8c8ffca-0ac4-49e2-b92b-e4a15b63bec3	Understanding Dimensional Consistency	Consider a hypothetical equation for calculating the energy E (in joules) of a system: E = a * v^2 * t, where v is the velocity in meters per second, t is the time in seconds, and a is a dimensionless constant. Which of the following must be true for the equation to be dimensionally consistent?	mcq	medium	physics	general	Class 11	{Units and Measurements}	1	2	true	2025-07-14T02:23:04.241Z	2025-07-14T02:23:04.241Z	{}
da1de455-4965-4d02-83fd-9cc5f2c7edf5	Understanding Scalars and Vectors	Which of the following statements is true regarding scalars and vectors in physics?	mcq	medium	physics	general	Class 11	{Scalars and Vectors}	1	2	true	2025-07-14T02:23:04.241Z	2025-07-14T02:23:04.241Z	{}
dcf7b76c-41af-4edc-89fb-89e1f9b6a3b5	Understanding Uniformly Accelerated Motion	A car starts from rest and accelerates uniformly along a straight road. After a certain time t, it covers a distance s. If the car accelerates at a rate of 2a instead, what distance will it cover in the same time t?	mcq	medium	physics	general	Class 11	{Motion in a Straight Line}	1	2	true	2025-07-14T02:23:04.241Z	2025-07-14T02:23:04.241Z	{}
4be49735-a0aa-4f5e-be18-9d7b702a93ce	Projectile Motion Analysis	A projectile is launched with an initial velocity of 20 m/s at an angle of 30 degrees above the horizontal. Assuming no air resistance, what is the total time of flight for the projectile?	mcq	medium	physics	general	Class 11	{Motion in a Plane}	1	2	true	2025-07-14T02:23:04.241Z	2025-07-14T02:23:04.241Z	{}
3f592f7c-c57e-435d-8922-bc8fee4469ec	Projectile Motion: Maximum Height	A projectile is launched from the ground with an initial velocity of 20 m/s at an angle of 45 degrees to the horizontal. Assuming no air resistance, what is the maximum height reached by the projectile?	mcq	medium	physics	general	Class 11	{Projectile Motion}	1	2	true	2025-07-14T02:23:04.241Z	2025-07-14T02:23:04.241Z	{}
4be0464e-dc4f-41ec-b2dc-cf84edf59b87	Relative Velocity in a River	A boat needs to cross a river that flows due east at 3 m/s. The boat's speed in still water is 5 m/s. If the boat points its bow due north, what is the magnitude of the boat's velocity relative to an observer on the shore?	mcq	medium	physics	general	Class 11	{Relative Velocity}	1	2	true	2025-07-14T02:23:04.241Z	2025-07-14T02:23:04.241Z	{}
9700952a-6f35-49b3-ab36-42de4527c39d	Understanding Friction and Motion	A block of mass 5 kg is placed on a horizontal surface with a coefficient of static friction of 0.4 and a coefficient of kinetic friction of 0.3. A horizontal force is gradually applied to the block. What is the minimum force required to initiate the motion of the block?	mcq	medium	physics	general	Class 11	{Laws of Motion}	1	2	true	2025-07-14T02:23:04.241Z	2025-07-14T02:23:04.241Z	{}
b8751d94-7444-4e65-bf1a-be862a64c652	Understanding the Role of Friction on an Inclined Plane	A block of mass m is placed on a rough inclined plane with an angle of inclination θ. The coefficient of static friction between the block and the plane is μ_s. The block is at rest. Which of the following conditions must be satisfied for the block to start sliding down the plane?	mcq	medium	physics	general	Class 11	{Friction}	1	2	true	2025-07-14T02:23:04.241Z	2025-07-14T02:23:04.241Z	{}
840c44a8-9647-4fce-86c5-4cf03c70fed1	Analyzing Forces in Circular Motion	A car of mass 1000 kg is moving along a circular track of radius 50 meters at a constant speed of 20 m/s. At a certain point, the road is banked at an angle θ with respect to the horizontal. Determine the angle θ required such that no friction is needed to maintain the car's circular path.	mcq	medium	physics	general	Class 11	{Circular Motion}	1	2	true	2025-07-14T02:23:04.241Z	2025-07-14T02:23:04.241Z	{}
faaa17ba-ddd4-4aa8-ada6-8237d5c4a2c6	Kinetic Energy and Work-Energy Theorem	A 0.5 kg block is initially at rest on a frictionless horizontal surface. A constant horizontal force of 3 N is applied to the block. How much work is done by the force when the block has moved 2 meters, and what is its final kinetic energy?	mcq	medium	physics	general	Class 11	{Work, Energy and Power}	1	2	true	2025-07-14T02:23:04.241Z	2025-07-14T02:23:04.241Z	{}
30a3f8c0-8742-4a3a-9b1f-e534eff3891b	Conservation of Energy in a Pendulum System	A pendulum consists of a bob of mass m attached to a string of length L, swinging in a vertical plane. At its highest point, the bob is at a height h above its lowest point and momentarily at rest. Ignoring air resistance and friction, what is the speed of the bob when it passes through the lowest point of its swing?	mcq	medium	physics	general	Class 11	{Conservation of Energy}	1	2	true	2025-07-14T02:23:04.241Z	2025-07-14T02:23:04.241Z	{}
8535b28f-4a24-4a1f-899e-e8f315834a2b	Collision and Conservation of Momentum	Two ice skaters, Skater A and Skater B, are initially at rest on a frictionless ice rink. Skater A, with mass 60 kg, pushes Skater B, with mass 80 kg. After the push, Skater A moves with a velocity of 4 m/s to the left. What is the velocity of Skater B after the push?	mcq	medium	physics	general	Class 11	{Conservation of Momentum}	1	2	true	2025-07-14T02:23:04.241Z	2025-07-14T02:23:04.241Z	{}
36dc204e-e9d5-48d3-8059-9d404fb2a6cf	Understanding Fundamental Units	Which of the following sets of units is NOT a fundamental SI unit?	mcq	medium	physics	general	Class 11	{Units and Measurements}	1	2	true	2025-07-14T02:23:04.241Z	2025-07-14T02:23:04.241Z	{}
6dc63bdc-7d8c-46db-9d5c-6fbb6941f9f6	Understanding Scalars and Vectors	A ship sails 100 km east and then 100 km north. What is the total displacement of the ship from its starting point?	mcq	medium	physics	general	Class 11	{Scalars and Vectors}	1	2	true	2025-07-14T02:23:04.241Z	2025-07-14T02:23:04.241Z	{}
54605b93-8fff-4d4f-9d57-d61261a13314	Analyzing Motion on an Inclined Plane	A block is released from rest at the top of a frictionless inclined plane that makes an angle θ with the horizontal. If the block travels a distance d down the incline, what is the expression for the time t it takes to reach the bottom?	mcq	medium	physics	general	Class 11	{Motion in a Straight Line}	1	2	true	2025-07-14T02:23:04.241Z	2025-07-14T02:23:04.241Z	{}
a37a9971-cfeb-4672-86d4-8e2ea71a3c10	Projectile Motion and Range	A projectile is launched with an initial speed of 20 m/s at an angle of 30° with the horizontal. Ignoring air resistance, what is the horizontal range of the projectile?	mcq	medium	physics	general	Class 11	{Motion in a Plane}	1	2	true	2025-07-14T02:23:04.241Z	2025-07-14T02:23:04.241Z	{}
3d4e4764-4de2-462e-aaf9-dd1a32d17890	Projectile Motion: Maximum Range on an Inclined Plane	An object is launched with an initial speed \( v_0 \) from the base of a frictionless inclined plane that makes an angle \( \theta \) with the horizontal. The object is launched at an angle \( \alpha \) relative to the inclined plane. What angle \( \alpha \) will maximize the range of the projectile along the plane?	mcq	medium	physics	general	Class 11	{Projectile Motion}	1	2	true	2025-07-14T02:23:04.241Z	2025-07-14T02:23:04.241Z	{}
65c5433c-02d6-4b7c-9822-f3adcb1e6962	Relative Velocity in a River	A boat is trying to cross a river that flows east to west at a speed of 3 m/s. The boat's speed in still water is 4 m/s. The river is 100 meters wide and the boat is pointed directly north, perpendicular to the riverbank. How far downstream will the boat be when it reaches the opposite bank?	mcq	medium	physics	general	Class 11	{Relative Velocity}	1	2	true	2025-07-14T02:23:04.241Z	2025-07-14T02:23:04.241Z	{}
ed1e6419-05df-426f-bb3c-62653915d817	Understanding the Effect of Friction on Motion	A block of mass 5 kg is placed on a rough horizontal surface. A horizontal force of 20 N is applied to the block. If the coefficient of static friction between the block and the surface is 0.4, what is the net force acting on the block? (Assume g = 9.8 m/s²).	mcq	medium	physics	general	Class 11	{Laws of Motion}	1	2	true	2025-07-14T02:23:04.241Z	2025-07-14T02:23:04.241Z	{}
5b56716c-d4cd-4c8d-b8c1-9c2a577f3ddb	Understanding the Effects of Friction on Motion	A block of mass 5 kg is placed on a horizontal surface with a coefficient of static friction μs = 0.4 and a coefficient of kinetic friction μk = 0.3. A horizontal force is gradually applied to the block. What is the minimum force required to start moving the block?	mcq	medium	physics	general	Class 11	{Friction}	1	2	true	2025-07-14T02:23:04.241Z	2025-07-14T02:23:04.241Z	{}
0dbc0bd3-a9b0-4b8d-8a4a-1f24d2cba673	Understanding Centripetal Force in Circular Motion	A car of mass 1500 kg is traveling around a circular track of radius 100 meters at a constant speed of 20 m/s. What is the magnitude of the centripetal force acting on the car?	mcq	medium	physics	general	Class 11	{Circular Motion}	1	2	true	2025-07-14T02:23:04.241Z	2025-07-14T02:23:04.241Z	{}
1e2a1f5f-f8b5-4eaa-8e38-54ba542dd8a5	Work Done by a Variable Force	A particle moves along the x-axis under the influence of a variable force given by F(x) = 3x^2 - 2x + 4 (in newtons), where x is the position in meters. Calculate the work done by this force as the particle moves from x = 1 m to x = 3 m.	mcq	medium	physics	general	Class 11	{Work, Energy and Power}	1	2	true	2025-07-14T02:23:04.241Z	2025-07-14T02:23:04.241Z	{}
281fe119-fc6e-487c-ae28-e71312aadf69	Understanding Energy Transformation on a Frictionless Track	A small block of mass m slides down a frictionless track from a height h and then ascends a frictionless ramp at an angle θ with respect to the horizontal. What is the maximum vertical height H above the ground that the block reaches on the other side?	mcq	medium	physics	general	Class 11	{Conservation of Energy}	1	2	true	2025-07-14T02:23:04.242Z	2025-07-14T02:23:04.242Z	{}
d4d24dd3-0749-467d-904e-ef6280ee6462	Conservation of Momentum in a Two-Body Collision	Two ice skaters, Skater A and Skater B, are initially at rest on a frictionless ice surface. Skater A has a mass of 50 kg and pushes Skater B, who has a mass of 70 kg, causing Skater B to move away with a velocity of 2 m/s. What is the velocity of Skater A after the push?	mcq	medium	physics	general	Class 11	{Conservation of Momentum}	1	2	true	2025-07-14T02:23:04.242Z	2025-07-14T02:23:04.242Z	{}
6483ec3f-964c-4dc1-8ddb-b1c8ca1baf1f	Understanding Dimensional Consistency in Physics Equations	Which of the following equations is dimensionally consistent?	mcq	medium	physics	general	Class 11	{Units and Measurements}	1	2	true	2025-07-14T02:23:04.242Z	2025-07-14T02:23:04.242Z	{}
634e1827-9f72-4ab4-bd3a-0980ede19d6b	Understanding Scalars and Vectors	A boat travels across a river that flows from west to east with a uniform current. If the boat's velocity relative to the water is directed due north, which of the following statements is true about the boat's resultant velocity relative to an observer on the riverbank?	mcq	medium	physics	general	Class 11	{Scalars and Vectors}	1	2	true	2025-07-14T02:23:04.242Z	2025-07-14T02:23:04.242Z	{}
3b6fba26-1a7f-4ce5-9a3b-e36404c97bc5	Analysis of Motion in a Straight Line	A car travels along a straight road for a distance of 100 meters. For the first half of the distance, it moves with a constant speed of 10 m/s. For the second half, it travels at a constant speed of 20 m/s. What is the average speed of the car over the entire journey?	mcq	medium	physics	general	Class 11	{Motion in a Straight Line}	1	2	true	2025-07-14T02:23:04.242Z	2025-07-14T02:23:04.242Z	{}
8f2ea884-d077-4c2b-8a6c-04f0dd2267e6	Projectile Motion and Maximum Range	A projectile is launched from the ground with an initial speed of \( v_0 \) at an angle \( \theta \) with the horizontal. Assuming no air resistance, at what angle \( \theta \) should the projectile be launched to achieve maximum range?	mcq	medium	physics	general	Class 11	{Motion in a Plane}	1	2	true	2025-07-14T02:23:04.242Z	2025-07-14T02:23:04.242Z	{}
869fe84f-bcef-40d1-b6c5-0e394a0edc97	Projectile Motion on an Inclined Plane	A projectile is launched with an initial velocity of 20 m/s from the base of an inclined plane that makes an angle of 30 degrees with the horizontal. The projectile is launched at an angle of 60 degrees with respect to the horizontal. Assuming no air resistance, what is the maximum height above the inclined plane that the projectile reaches?	mcq	medium	physics	general	Class 11	{Projectile Motion}	1	2	true	2025-07-14T02:23:04.242Z	2025-07-14T02:23:04.242Z	{}
16296323-f65a-4918-b91f-349eef4cc2d8	Relative Velocity in Two-Dimensional Motion	A boat is crossing a river that flows from west to east with a speed of 3 m/s. The boat is heading directly north with a speed of 4 m/s relative to the water. What is the magnitude of the velocity of the boat relative to the ground?	mcq	medium	physics	general	Class 11	{Relative Velocity}	1	2	true	2025-07-14T02:23:04.242Z	2025-07-14T02:23:04.242Z	{}
0bc80990-8bad-4181-9460-e127627c4783	Understanding Newton's Third Law of Motion	Two ice skaters, Skater A and Skater B, are initially at rest on a frictionless ice surface. They push off each other and move in opposite directions. If Skater A has a mass of 50 kg and moves with a velocity of 2 m/s, what is the velocity of Skater B, who has a mass of 70 kg, after the push?	mcq	medium	physics	general	Class 11	{Laws of Motion}	1	2	true	2025-07-14T02:23:04.242Z	2025-07-14T02:23:04.242Z	{}
